<?xml version="1.0" encoding="utf-8" ?>
<Fable xmlns="https://fablescript.org/schema/core"
       xmlns:xsi="http://www.w3.org/2001/XMLSchema-instance"
       xsi:schemaLocation="https://fablescript.org/schema/core ../../Src/Core/Fablescript.Core/Fablescript/Fablescript.xsd">
  <Title>Jokull</Title>
  <Description>A story of ice and mystery.</Description>
  <InitialLocation>BlackBeach</InitialLocation>
  <Locations>
    <Location>
      <Name>BlackBeach</Name>
      <Title>Black sand beach</Title>
      <Introduction>You find yourself resting on the sand with no rememberence of how you came here or who you are.</Introduction>
      <Facts>
        <Fact>
          <Text>The beach stretches as far as you can see to the east and west.</Text>
        </Fact>
        <Fact>
          <Text>Black sand covers all the beach.</Text>
        </Fact>
        <Fact>
          <Text>The sea is calm and stretches to infinity without interruptions.</Text>
        </Fact>
        <Fact>
          <Text>Soft mountains rises in the distance to the north. A huge glacier tops the central mountain.</Text>
        </Fact>
      </Facts>
      <Exits>
        <Exit>
          <Name>East</Name>
          <Title>East</Title>
          <Description>The beach stretches to the east.</Description>
          <TargetLocationName>BlackBeachEast</TargetLocationName>
        </Exit>
      </Exits>
    </Location>

    <Location>
      <Name>BlackBeachEast</Name>
      <Title>Eastern end of black sand beach</Title>
      <Facts>
        <Fact>
          <Text>The beach stretches as far as you can see to the west.</Text>
        </Fact>
        <Fact>
          <Text>Cliffs rises in the east.</Text>
        </Fact>
        <Fact>
          <Text>Black sand covers all the beach.</Text>
        </Fact>
        <Fact>
          <Text>The sea is calm and stretches to infinity without interruptions.</Text>
        </Fact>
        <Fact>
          <Text>Soft mountains rises in the distance to the north. A huge glacier tops the central mountain.</Text>
        </Fact>
      </Facts>
      <Exits>
        <Exit>
          <Name>West</Name>
          <Title>West</Title>
          <Description>The beach stretches to the west.</Description>
          <TargetLocationName>BlackBeach</TargetLocationName>
        </Exit>
        <Exit>
          <Name>East</Name>
          <Title>East</Title>
          <Description>A gentle slope leads uphill to the top of the cliffs.</Description>
          <TargetLocationName>Cliffs</TargetLocationName>
        </Exit>
      </Exits>
    </Location>

    <Location>
      <Name>Cliffs</Name>
      <Title>The cliffs</Title>
      <Facts>
        <Fact>
          <Text>On a remote peninsula where high cliffs meet the sea.</Text>
        </Fact>
        <Fact>
          <Text>Cries from distant shalkren floating on the wind can be heard.</Text>
        </Fact>
        <Fact>
          <Text>At the edge of the cliffs a small Tervuun nests.</Text>
        </Fact>
        <Fact>
          <Text>A smell of old fish fills the air.</Text>
        </Fact>
      </Facts>
      <Exits>
        <Exit>
          <Name>West</Name>
          <Title>West</Title>
          <Description>A gentle slope leads west to the black beach.</Description>
          <TargetLocationName>BlackBeachEast</TargetLocationName>
        </Exit>
      </Exits>
    </Location>
  </Locations>
</Fable>