<?xml version="1.0" encoding="utf-8"?>
<Fable xmlns="https://fablescript.org/schema/core"
       xmlns:xsi="http://www.w3.org/2001/XMLSchema-instance"
       xsi:schemaLocation="https://fablescript.org/schema/core ../../Src/Core/Fablescript.Core/Fablescript/Fablescript.xsd">
  <Title>Techspire HQ</Title>
  <Description>A day in the life at a bustling IT company headquarters.</Description>
  <InitialLocation>Lobby</InitialLocation>

  <Locations>
    <Location>
      <Name>Lobby</Name>
      <Title>Building Lobby</Title>
      <Introduction>You step into the modern lobby of Techspire HQ.</Introduction>
      <Facts>
        <Fact><Text>Clean white walls and minimalist furniture surround you.</Text></Fact>
        <Fact><Text>A receptionist desk stands to the north, unoccupied.</Text></Fact>
        <Fact><Text>A security camera silently rotates above the entrance.</Text></Fact>
      </Facts>
      <Exits>
        <Exit>
          <Name>North</Name>
          <Title>North</Title>
          <Description>Glass doors lead into the main office floor.</Description>
          <TargetLocationName>MainOffice</TargetLocationName>
        </Exit>
        <Exit>
          <Name>East</Name>
          <Title>East</Title>
          <Description>A door labeled 'Break Room'.</Description>
          <TargetLocationName>BreakRoom</TargetLocationName>
        </Exit>
      </Exits>
    </Location>

    <Location>
      <Name>MainOffice</Name>
      <Title>Main Office Floor</Title>
      <Facts>
        <Fact><Text>Rows of desks with monitors, cables, and coffee mugs.</Text></Fact>
        <Fact><Text>The hum of computers fills the air.</Text></Fact>
        <Fact><Text>Some screens show code, others display spreadsheets.</Text></Fact>
      </Facts>
      <Exits>
        <Exit>
          <Name>South</Name>
          <Title>South</Title>
          <Description>Back to the lobby.</Description>
          <TargetLocationName>Lobby</TargetLocationName>
        </Exit>
        <Exit>
          <Name>North</Name>
          <Title>North</Title>
          <Description>A hallway leads to the server room.</Description>
          <TargetLocationName>ServerRoom</TargetLocationName>
        </Exit>
        <Exit>
          <Name>West</Name>
          <Title>West</Title>
          <Description>A door labeled 'Meeting Room 1'.</Description>
          <TargetLocationName>MeetingRoom1</TargetLocationName>
        </Exit>
      </Exits>
    </Location>

    <Location>
      <Name>BreakRoom</Name>
      <Title>Break Room</Title>
      <Facts>
        <Fact><Text>A coffee machine gurgles next to a fridge full of energy drinks.</Text></Fact>
        <Fact><Text>A couch and a ping pong table occupy the center.</Text></Fact>
        <Fact><Text>The smell of microwaved meals lingers in the air.</Text></Fact>
      </Facts>
      <Exits>
        <Exit>
          <Name>West</Name>
          <Title>West</Title>
          <Description>Back to the lobby.</Description>
          <TargetLocationName>Lobby</TargetLocationName>
        </Exit>
      </Exits>
    </Location>

    <Location>
      <Name>ServerRoom</Name>
      <Title>Server Room</Title>
      <Facts>
        <Fact><Text>Rows of blinking servers stand tall behind locked racks.</Text></Fact>
        <Fact><Text>A low hum and a blast of cold air greet you.</Text></Fact>
        <Fact><Text>A warning sign reads: "Authorized Personnel Only".</Text></Fact>
      </Facts>
      <Exits>
        <Exit>
          <Name>South</Name>
          <Title>South</Title>
          <Description>Return to the main office floor.</Description>
          <TargetLocationName>MainOffice</TargetLocationName>
        </Exit>
        <Exit>
          <Name>East</Name>
          <Title>East</Title>
          <Description>A narrow door marked 'IT Storage'.</Description>
          <TargetLocationName>ITStorage</TargetLocationName>
        </Exit>
      </Exits>
    </Location>

    <Location>
      <Name>ITStorage</Name>
      <Title>IT Storage Closet</Title>
      <Facts>
        <Fact><Text>Stacks of old monitors and tangled cables clutter the room.</Text></Fact>
        <Fact><Text>An old printer sits unplugged in a corner.</Text></Fact>
      </Facts>
      <Exits>
        <Exit>
          <Name>West</Name>
          <Title>West</Title>
          <Description>Back to the server room.</Description>
          <TargetLocationName>ServerRoom</TargetLocationName>
        </Exit>
      </Exits>
    </Location>

    <Location>
      <Name>MeetingRoom1</Name>
      <Title>Meeting Room Alpha</Title>
      <Facts>
        <Fact><Text>A large table and a wall-mounted display dominate the room.</Text></Fact>
        <Fact><Text>Sticky notes and whiteboard scribbles from a recent meeting are still visible.</Text></Fact>
      </Facts>
      <Exits>
        <Exit>
          <Name>East</Name>
          <Title>East</Title>
          <Description>Return to the main office floor.</Description>
          <TargetLocationName>MainOffice</TargetLocationName>
        </Exit>
        <Exit>
          <Name>North</Name>
          <Title>North</Title>
          <Description>A hallway leads to the HR office.</Description>
          <TargetLocationName>HRDepartment</TargetLocationName>
        </Exit>
      </Exits>
    </Location>

    <Location>
      <Name>HRDepartment</Name>
      <Title>HR Department</Title>
      <Facts>
        <Fact><Text>Soft music plays faintly in the background.</Text></Fact>
        <Fact><Text>A bulletin board with company policies hangs on one wall.</Text></Fact>
      </Facts>
      <Exits>
        <Exit>
          <Name>South</Name>
          <Title>South</Title>
          <Description>Back to Meeting Room Alpha.</Description>
          <TargetLocationName>MeetingRoom1</TargetLocationName>
        </Exit>
        <Exit>
          <Name>East</Name>
          <Title>East</Title>
          <Description>A short corridor leads to the CEO's office.</Description>
          <TargetLocationName>CEOOffice</TargetLocationName>
        </Exit>
      </Exits>
    </Location>

    <Location>
      <Name>CEOOffice</Name>
      <Title>CEO's Office</Title>
      <Facts>
        <Fact><Text>Large glass windows overlook the city skyline.</Text></Fact>
        <Fact><Text>A minimalist desk holds a sleek laptop and a succulent.</Text></Fact>
        <Fact><Text>A shelf of awards lines one wall.</Text></Fact>
      </Facts>
      <Exits>
        <Exit>
          <Name>West</Name>
          <Title>West</Title>
          <Description>Return to the HR department.</Description>
          <TargetLocationName>HRDepartment</TargetLocationName>
        </Exit>
      </Exits>
    </Location>

    <Location>
      <Name>TestingLab</Name>
      <Title>QA Testing Lab</Title>
      <Facts>
        <Fact><Text>Workstations with dual monitors and testing devices fill the room.</Text></Fact>
        <Fact><Text>Posters of bug life cycles and QA workflows are pinned to the walls.</Text></Fact>
      </Facts>
      <Exits>
        <Exit>
          <Name>West</Name>
          <Title>West</Title>
          <Description>Doorway to the Main Office Floor.</Description>
          <TargetLocationName>MainOffice</TargetLocationName>
        </Exit>
      </Exits>
    </Location>

    <Location>
      <Name>Rooftop</Name>
      <Title>Office Rooftop</Title>
      <Facts>
        <Fact><Text>The rooftop offers a panoramic view of the tech district.</Text></Fact>
        <Fact><Text>Employees sometimes come here to relax or take phone calls.</Text></Fact>
      </Facts>
      <Exits>
        <Exit>
          <Name>Down</Name>
          <Title>Down</Title>
          <Description>Stairs lead down into the break room area.</Description>
          <TargetLocationName>BreakRoom</TargetLocationName>
        </Exit>
      </Exits>
    </Location>
  </Locations>

  <Objects>
    <Object>
      <Name>Keycard</Name>
      <Title>Employee Keycard</Title>
      <Description>A plastic badge labeled "Techspire - Level 3 Access".</Description>
      <Location>Lobby</Location>
    </Object>
  </Objects>
</Fable>
